match,market_name,home_team,home_win,draw,away_team,away_win,margin,agency
Arsenal v Nottingham Forest,Head To Head,Arsenal,1.37,4.75,Nottingham Forest,7,1.083,Dabble
Bournemouth v Brighton & Hove Albion,Head To Head,Bournemouth,2.35,3.5,Brighton & Hove Albion,2.7,1.082,Dabble
Brentford v Chelsea,Head To Head,Brentford,4,3.75,Chelsea,1.77,1.082,Dabble
Crystal Palace v Sunderland,Head To Head,Crystal Palace,1.62,3.75,Sunderland,5,1.084,Dabble
Everton v Aston Villa,Head To Head,Everton,2.35,3.3,Aston Villa,2.8,1.086,Dabble
Fulham v Leeds United,Head To Head,Fulham,1.85,3.6,Leeds United,3.75,1.085,Dabble
Newcastle United v Wolverhampton Wanderers,Head To Head,Newcastle United,1.42,4.4,Wolverhampton Wanderers,6.5,1.085,Dabble
West Ham United v Tottenham Hotspur,Head To Head,West Ham United,3.1,3.5,Tottenham Hotspur,2.1,1.084,Dabble
