home_team,away_team,market_name,player_name,line,over_price,under_price,agency,match
Sunderland,West Ham United,Player Assists,Jarrod Bowen,0.5,3.6,NA,Dabble,Sunderland v West Ham United
Tottenham Hotspur,Burnley,Player Assists,Richarlison,0.5,3.15,NA,Dabble,Tottenham Hotspur v Burnley
Wolverhampton Wanderers,Manchester City,Player Assists,Phil Foden,0.5,3.15,NA,Dabble,Wolverhampton Wanderers v Manchester City
Wolverhampton Wanderers,Manchester City,Player Assists,Rayan Cherki,0.5,3.15,NA,Dabble,Wolverhampton Wanderers v Manchester City
Chelsea,Crystal Palace,Player Assists,Cole Palmer,0.5,3.15,NA,Dabble,Chelsea v Crystal Palace
Manchester United,Arsenal,Player Assists,Matheus Cunha,0.5,4.5,NA,Dabble,Manchester United v Arsenal
Manchester United,Arsenal,Player Assists,Bukayo Saka,0.5,3.38,NA,Dabble,Manchester United v Arsenal
Manchester United,Arsenal,Player Assists,Martin <c3><98>degaard,0.5,4.05,NA,Dabble,Manchester United v Arsenal
