match,market_name,home_team,away_team,home_win,draw,away_win,margin,agency
Nottingham Forest v Brentford,Head To Head,Nottingham Forest,Brentford,2.1,3.3,3.4,1.07,Neds
Leeds United v Everton,Head To Head,Leeds United,Everton,2.35,3.25,2.95,1.07,Neds
Wolverhampton Wanderers v Manchester City,Head To Head,Wolverhampton Wanderers,Manchester City,5.75,4.4,1.5,1.07,Neds
Brighton & Hove Albion v Fulham,Head To Head,Brighton & Hove Albion,Fulham,1.9,3.5,3.8,1.08,Neds
Chelsea v Crystal Palace,Head To Head,Chelsea,Crystal Palace,1.62,4.2,4.75,1.07,Neds
Sunderland AFC v West Ham United,Head To Head,Sunderland AFC,West Ham United,3.25,3.15,2.25,1.07,Neds
Tottenham Hotspur v Burnley,Head To Head,Tottenham Hotspur,Burnley,1.52,4.1,5.8,1.07,Neds
Manchester United v Arsenal,Head To Head,Manchester United,Arsenal,4,3.6,1.85,1.07,Neds
